{
  "$schema": "https://json-schema.org/draft/2020-12/schema",
  "title": "zero-gap evidence SIDECAR record (the chain file itself is the verifier-native JSONL; see data-model.md)",
  "type": "object",
  "required": [
    "ts",
    "cwd",
    "argv",
    "exit_status",
    "duration_ms",
    "stdout_digest",
    "stderr_digest",
    "stdout_bytes",
    "stderr_bytes",
    "stream_ref",
    "stream_truncated",
    "stream_redacted",
    "item_id",
    "check_id",
    "state_fingerprint_before",
    "state_fingerprint_after",
    "population_kind",
    "outcome",
    "verdict_role",
    "chain_seq",
    "independence_tier",
    "evidence_class"
  ],
  "properties": {
    "ts": {
      "type": "string",
      "format": "date-time"
    },
    "cwd": {
      "type": "string"
    },
    "argv": {
      "type": "array",
      "items": {
        "type": "string"
      },
      "minItems": 1,
      "description": "argument vector as a JSON array of strings (upstream ExecRow.Argv is []string; the recorder writes an array; a joined string is forbidden by \u00a711.4.115(H)(1))"
    },
    "exit_status": {
      "type": "integer"
    },
    "duration_ms": {
      "type": "integer",
      "minimum": 0
    },
    "stdout_digest": {
      "type": "string",
      "pattern": "^[0-9a-f]{64}$",
      "description": "sha256 over the FULL stream, before truncation"
    },
    "stderr_digest": {
      "type": "string",
      "pattern": "^[0-9a-f]{64}$"
    },
    "stdout_bytes": {
      "type": "integer",
      "minimum": 0
    },
    "stderr_bytes": {
      "type": "integer",
      "minimum": 0
    },
    "stream_ref": {
      "type": "string",
      "description": "directory OUTSIDE version control"
    },
    "stream_truncated": {
      "type": "boolean"
    },
    "stream_redacted": {
      "type": "boolean"
    },
    "item_id": {
      "type": "string",
      "pattern": "^[A-Z]{3}-[0-9]{3,}$|^SWEEP$"
    },
    "check_id": {
      "type": "string"
    },
    "state_fingerprint_before": {
      "type": "string",
      "pattern": "^[0-9a-f]{64}$"
    },
    "state_fingerprint_after": {
      "type": "string",
      "pattern": "^[0-9a-f]{64}$"
    },
    "population_kind": {
      "enum": [
        "source",
        "process",
        "wire"
      ]
    },
    "outcome": {
      "enum": [
        0,
        1,
        2
      ],
      "description": "0 holds, 1 violated, 2 could not determine"
    },
    "verdict_role": {
      "enum": [
        "author",
        "verifier"
      ]
    },
    "chain_seq": {
      "type": "integer",
      "minimum": 0,
      "description": "LOAD-BEARING: MUST equal the `seq` of the chain record whose artifact_path binds this sidecar line; the adapter fails on any mismatch"
    },
    "independence_tier": {
      "type": "string",
      "description": "supplied to the chain record (instance|model|capability per the constitution's independence_tier lib)"
    },
    "evidence_class": {
      "type": "string",
      "description": "supplied to the chain record (runtime|artifact|source); distinct from population_kind"
    },
    "wire_capture_digest": {
      "type": "string",
      "pattern": "^[0-9a-f]{64}$",
      "description": "T063/FR-017: sha256 of the wire capture (HTTP response or socket capture). REQUIRED when population_kind is wire, FORBIDDEN otherwise; all-zero is refused (not expressible here, enforced by the adapter)."
    },
    "wire_capture_kind": {
      "enum": ["http_response", "socket"],
      "description": "T063/FR-017: what kind of capture wire_capture_digest digests. Same presence rule as wire_capture_digest."
    }
  },
  "additionalProperties": false,
  "$comment": "T063/FR-017 wire rule (not expressible by this interpreter, which refuses allOf/if/then by design; a first cut that used allOf made every recording fail pre-flight): population_kind wire REQUIRES wire_capture_digest (64 lowercase hex, not all zeroes) AND wire_capture_kind; every other population_kind FORBIDS both. Enforced by the zg-chain adapter (validateRequest) and by workable-items validate_gap.go. Invariant not expressible in JSON Schema: outcome 0 or 1 requires state_fingerprint_before == state_fingerprint_after; otherwise outcome MUST be 2. Enforced by the adapter and its Go/shell test. The verifier-native chain record has EXACTLY nine fields (seq, ts, command, exit_status, artifact_path, evidence_class, author_session_id, independence_tier, prev_digest), unknown fields are REFUSED, genesis prev_digest is the empty string, and artifact_path = \"sha256:<hex of the exact sidecar line bytes>\" binds the two files. The adapter MUST verify that binding itself (the verifier never reads the sidecar)."
}
