{"chain_seq":257,"ts":"2026-10-12T10:40:51Z","cwd":"/tmp/zgv.D6DRaA/pre","argv":["bash","-c","bash /home/milosvasic/Projects/vasic/docs/zero-gap/checks/VSC-373.probe.sh"],"exit_status":1,"duration_ms":9854,"stdout_digest":"896964960cf90d2ca2d79ed3a3f2900f8d987603756e1dfc950b605952f601f0","stderr_digest":"e3b0c44298fc1c149afbf4c8996fb92427ae41e4649b934ca495991b7852b855","stdout_bytes":364,"stderr_bytes":0,"stream_ref":"20261012T104040Z_2634879","stream_truncated":false,"stream_redacted":false,"item_id":"VSC-373","check_id":"chk-vsc-373-r5-sees-nested-tools","state_fingerprint_before":"d7c49679de7c37fb6eef948860fe4b4b761a435b02bb7a1a8d6af90eb8b96a96","state_fingerprint_after":"d7c49679de7c37fb6eef948860fe4b4b761a435b02bb7a1a8d6af90eb8b96a96","population_kind":"process","outcome":1,"verdict_role":"author","independence_tier":"instance","evidence_class":"runtime"}
