{"chain_seq":219,"ts":"2026-10-12T10:24:13Z","cwd":"<repo>","argv":["bash","-c","bash /home/milosvasic/Projects/vasic/docs/zero-gap/checks/VSC-381.probe.sh"],"exit_status":0,"duration_ms":227,"stdout_digest":"7ad3e354d7143ae1577d6d5b3cfa26a2accecdaa5aec102478f0fde93bc5aa28","stderr_digest":"e3b0c44298fc1c149afbf4c8996fb92427ae41e4649b934ca495991b7852b855","stdout_bytes":46,"stderr_bytes":0,"stream_ref":"20261012T102412Z_2177755","stream_truncated":false,"stream_redacted":false,"item_id":"VSC-381","check_id":"chk-vsc-381-coverage-matrix-inspected","state_fingerprint_before":"6e68d3bdfb7e234b449507e65920eaa220876f17052f0bbdcafadcb45f81eddc","state_fingerprint_after":"6e68d3bdfb7e234b449507e65920eaa220876f17052f0bbdcafadcb45f81eddc","population_kind":"process","outcome":0,"verdict_role":"verifier","independence_tier":"instance","evidence_class":"runtime"}
