{"chain_seq":174,"ts":"2026-10-08T18:33:32Z","cwd":"/tmp/zgv.EB6yIB/pre","argv":["bash","-c","R=$(cd \"$(git rev-parse --git-common-dir)/..\" && pwd) && bash \"$R/docs/zero-gap/checks/probes/vsc-376.sh\""],"exit_status":1,"duration_ms":3101,"stdout_digest":"496c3dc94741bcfd75f71b06abcb188a91cf3ede0b77b7d2c96f4857eba8bff0","stderr_digest":"e3b0c44298fc1c149afbf4c8996fb92427ae41e4649b934ca495991b7852b855","stdout_bytes":107,"stderr_bytes":0,"stream_ref":"20261008T183328Z_4087288","stream_truncated":false,"stream_redacted":false,"item_id":"VSC-376","check_id":"VSC376-sweep-empty-population-undetermined","state_fingerprint_before":"766a81950717b14979692a0882fd591681f2203c836a605244a339a2687ec5a3","state_fingerprint_after":"766a81950717b14979692a0882fd591681f2203c836a605244a339a2687ec5a3","population_kind":"process","outcome":1,"verdict_role":"author","independence_tier":"instance","evidence_class":"runtime"}
