{"chain_seq":381,"ts":"2026-10-14T11:44:05Z","cwd":"/tmp/zgv.tqQXYr/cur","argv":["bash","-c","bash /home/milosvasic/Projects/vasic/docs/zero-gap/checks/VSC-352.probe.sh"],"exit_status":0,"duration_ms":20541,"stdout_digest":"e6c48bc12c97835c18adeb2e1999d2ab99ec9c7595731fb59b0e7290b417d485","stderr_digest":"e3b0c44298fc1c149afbf4c8996fb92427ae41e4649b934ca495991b7852b855","stdout_bytes":83,"stderr_bytes":0,"stream_ref":"20261014T114344Z_426437","stream_truncated":false,"stream_redacted":false,"item_id":"VSC-352","check_id":"chk-vsc-352-readme-rc-figures","state_fingerprint_before":"34acc21e5bc299eec043b8123714a78d4b4d70a7f82c02ce26c889b2a4595fd8","state_fingerprint_after":"34acc21e5bc299eec043b8123714a78d4b4d70a7f82c02ce26c889b2a4595fd8","population_kind":"process","outcome":0,"verdict_role":"author","independence_tier":"instance","evidence_class":"runtime"}
