{"chain_seq":274,"ts":"2026-10-12T10:46:35Z","cwd":"<repo>","argv":["bash","-c","bash /home/milosvasic/Projects/vasic/docs/zero-gap/checks/VSC-363.probe.sh"],"exit_status":0,"duration_ms":868,"stdout_digest":"e0f0a885483c96e55004ff9caf131249a7cf6b6b3d06508a87efb4e058c34eb0","stderr_digest":"e3b0c44298fc1c149afbf4c8996fb92427ae41e4649b934ca495991b7852b855","stdout_bytes":36,"stderr_bytes":0,"stream_ref":"20261012T104634Z_2723700","stream_truncated":false,"stream_redacted":false,"item_id":"VSC-363","check_id":"chk-vsc-363-six-cases","state_fingerprint_before":"36f94ba60d8663626f68412af1194b32e3739b36402e1faf6f90b1a168bd0772","state_fingerprint_after":"36f94ba60d8663626f68412af1194b32e3739b36402e1faf6f90b1a168bd0772","population_kind":"process","outcome":0,"verdict_role":"verifier","independence_tier":"instance","evidence_class":"runtime"}
