{"chain_seq":386,"ts":"2026-10-14T11:57:28Z","cwd":"/tmp/zgv.dnOfNW/pre","argv":["bash","-c","bash /home/milosvasic/Projects/vasic/docs/zero-gap/checks/VSC-353.probe.sh"],"exit_status":1,"duration_ms":12363,"stdout_digest":"28c35a33ecf526bccb8ea750b48ddc67dbf0af2196df9711cf0e638b343452d5","stderr_digest":"e3b0c44298fc1c149afbf4c8996fb92427ae41e4649b934ca495991b7852b855","stdout_bytes":4392,"stderr_bytes":0,"stream_ref":"20261014T115716Z_744632","stream_truncated":false,"stream_redacted":false,"item_id":"VSC-353","check_id":"chk-vsc-353-declared-owned-shapes","state_fingerprint_before":"d7c49679de7c37fb6eef948860fe4b4b761a435b02bb7a1a8d6af90eb8b96a96","state_fingerprint_after":"d7c49679de7c37fb6eef948860fe4b4b761a435b02bb7a1a8d6af90eb8b96a96","population_kind":"process","outcome":1,"verdict_role":"author","independence_tier":"instance","evidence_class":"runtime"}
