{"chain_seq":265,"ts":"2026-10-12T10:43:15Z","cwd":"/tmp/zgv.lSxq1E/pre","argv":["bash","-c","bash /home/milosvasic/Projects/vasic/docs/zero-gap/checks/VSC-359.probe.sh"],"exit_status":1,"duration_ms":111,"stdout_digest":"37691a6301366ab9bfbf115b6e78eab8f2df62f88f7f0a27d50f5a85fbba1ac6","stderr_digest":"e3b0c44298fc1c149afbf4c8996fb92427ae41e4649b934ca495991b7852b855","stdout_bytes":1554,"stderr_bytes":0,"stream_ref":"20261012T104315Z_2669442","stream_truncated":false,"stream_redacted":false,"item_id":"VSC-359","check_id":"chk-vsc-359-carrier-current-pins","state_fingerprint_before":"d7c49679de7c37fb6eef948860fe4b4b761a435b02bb7a1a8d6af90eb8b96a96","state_fingerprint_after":"d7c49679de7c37fb6eef948860fe4b4b761a435b02bb7a1a8d6af90eb8b96a96","population_kind":"process","outcome":1,"verdict_role":"author","independence_tier":"instance","evidence_class":"runtime"}
