{"chain_seq":322,"ts":"2026-10-12T11:16:34Z","cwd":"<repo>","argv":["bash","-c","bash /home/milosvasic/Projects/vasic/docs/zero-gap/checks/VSC-360.probe.sh"],"exit_status":0,"duration_ms":656,"stdout_digest":"e70e0088a5862e836b215a2b20e4914f41e90490b8cfa55fad683b2b2ef9398f","stderr_digest":"e3b0c44298fc1c149afbf4c8996fb92427ae41e4649b934ca495991b7852b855","stdout_bytes":46,"stderr_bytes":0,"stream_ref":"20261012T111633Z_3581583","stream_truncated":false,"stream_redacted":false,"item_id":"VSC-360","check_id":"chk-vsc-360-pushurl-lag-detected","state_fingerprint_before":"178d7d3d732ea5b01b3d74f9b359c8de4b1879e2d2af9f7824067f526921a6d4","state_fingerprint_after":"178d7d3d732ea5b01b3d74f9b359c8de4b1879e2d2af9f7824067f526921a6d4","population_kind":"process","outcome":0,"verdict_role":"author","independence_tier":"instance","evidence_class":"runtime"}
