{"chain_seq":199,"ts":"2026-10-12T10:18:28Z","cwd":"/tmp/zgv.Kb2SYu/pre","argv":["bash","-c","bash /home/milosvasic/Projects/vasic/docs/zero-gap/checks/VSC-385.probe.sh"],"exit_status":1,"duration_ms":23,"stdout_digest":"9e0acbc6729eaef222e9a7739ce0700fc7dc2eb77951503ce7bbdc4b7652c27b","stderr_digest":"e3b0c44298fc1c149afbf4c8996fb92427ae41e4649b934ca495991b7852b855","stdout_bytes":26,"stderr_bytes":0,"stream_ref":"20261012T101828Z_2103743","stream_truncated":false,"stream_redacted":false,"item_id":"VSC-385","check_id":"chk-vsc-385-no-unmeasured-probability","state_fingerprint_before":"d7c49679de7c37fb6eef948860fe4b4b761a435b02bb7a1a8d6af90eb8b96a96","state_fingerprint_after":"d7c49679de7c37fb6eef948860fe4b4b761a435b02bb7a1a8d6af90eb8b96a96","population_kind":"process","outcome":1,"verdict_role":"author","independence_tier":"instance","evidence_class":"runtime"}
