{"chain_seq":327,"ts":"2026-10-12T11:32:13Z","cwd":"<repo>","argv":["bash","-c","bash /home/milosvasic/Projects/vasic/docs/zero-gap/checks/VSC-360.probe.sh"],"exit_status":0,"duration_ms":707,"stdout_digest":"e70e0088a5862e836b215a2b20e4914f41e90490b8cfa55fad683b2b2ef9398f","stderr_digest":"e3b0c44298fc1c149afbf4c8996fb92427ae41e4649b934ca495991b7852b855","stdout_bytes":46,"stderr_bytes":0,"stream_ref":"20261012T113212Z_3667006","stream_truncated":false,"stream_redacted":false,"item_id":"VSC-360","check_id":"chk-vsc-360-pushurl-lag-detected","state_fingerprint_before":"3cbd012654586fefa542d4454c29633c89bc6d93ffe53fa0ee56a69157264c1c","state_fingerprint_after":"3cbd012654586fefa542d4454c29633c89bc6d93ffe53fa0ee56a69157264c1c","population_kind":"process","outcome":0,"verdict_role":"verifier","independence_tier":"instance","evidence_class":"runtime"}
