{"chain_seq":176,"ts":"2026-10-08T18:36:24Z","cwd":"/tmp/zgv.sXFHx9/pre","argv":["bash","-c","R=$(cd \"$(git rev-parse --git-common-dir)/..\" && pwd) && bash \"$R/docs/zero-gap/checks/probes/vsc-348.sh\""],"exit_status":1,"duration_ms":53833,"stdout_digest":"8b5e208bf0202fa40ac8e65bc163491341c11e193578d3e1c06cf00fdf01b603","stderr_digest":"e3b0c44298fc1c149afbf4c8996fb92427ae41e4649b934ca495991b7852b855","stdout_bytes":170,"stderr_bytes":0,"stream_ref":"20261008T183529Z_4187324","stream_truncated":false,"stream_redacted":false,"item_id":"VSC-348","check_id":"VSC348-badge-refuses-stale-ledger","state_fingerprint_before":"d7c49679de7c37fb6eef948860fe4b4b761a435b02bb7a1a8d6af90eb8b96a96","state_fingerprint_after":"d7c49679de7c37fb6eef948860fe4b4b761a435b02bb7a1a8d6af90eb8b96a96","population_kind":"process","outcome":1,"verdict_role":"author","independence_tier":"instance","evidence_class":"runtime"}
