{"chain_seq":376,"ts":"2026-10-14T11:40:13Z","cwd":"/tmp/zgv.pgaR32/pre","argv":["bash","-c","python3 -I \"$(git rev-parse --path-format=absolute --git-common-dir)/../docs/zero-gap/checks/probes/carrier_claims.py\" --suite 349"],"exit_status":1,"duration_ms":55461,"stdout_digest":"4d4f54cd163c1382c8fe53194624a753fda6b862d52a20b944cfab2a7515c204","stderr_digest":"e3b0c44298fc1c149afbf4c8996fb92427ae41e4649b934ca495991b7852b855","stdout_bytes":1690,"stderr_bytes":0,"stream_ref":"20261014T113917Z_72657","stream_truncated":false,"stream_redacted":false,"item_id":"VSC-349","check_id":"chk-vsc-349-carrier-figures-marked","state_fingerprint_before":"af18738746ee2d6471a0f47cebaac90b521f48ff6a54e587860430b0bbcb5aa0","state_fingerprint_after":"af18738746ee2d6471a0f47cebaac90b521f48ff6a54e587860430b0bbcb5aa0","population_kind":"process","outcome":1,"verdict_role":"author","independence_tier":"instance","evidence_class":"runtime"}
