{"ts":"2026-09-25T11:00:00Z","cwd":"<repo>","argv":["bash","scripts/zero-gap-class-example.sh"],"exit_status":0,"duration_ms":1200,"stdout_digest":"e3b0c44298fc1c149afbf4c8996fb92427ae41e4649b934ca495991b7852b855","stderr_digest":"e3b0c44298fc1c149afbf4c8996fb92427ae41e4649b934ca495991b7852b855","stdout_bytes":0,"stderr_bytes":0,"stream_ref":"<outside-vcs>/zero-gap/streams/VSC-004-green-other-check.json","stream_truncated":false,"stream_redacted":false,"item_id":"VSC-004","check_id":"CHK-some-other-check","state_fingerprint_before":"bbbbbbbbbbbbbbbbbbbbbbbbbbbbbbbbbbbbbbbbbbbbbbbbbbbbbbbbbbbbbbbb","state_fingerprint_after":"bbbbbbbbbbbbbbbbbbbbbbbbbbbbbbbbbbbbbbbbbbbbbbbbbbbbbbbbbbbbbbbb","population_kind":"source","outcome":0,"verdict_role":"author","chain_seq":5,"independence_tier":"instance","evidence_class":"runtime"}
