{"chain_seq":280,"ts":"2026-10-12T10:48:10Z","cwd":"<repo>","argv":["bash","-c","bash /home/milosvasic/Projects/vasic/docs/zero-gap/checks/VSC-384.probe.sh"],"exit_status":0,"duration_ms":609,"stdout_digest":"a00d506ba880be97635701fd9d910a2714b91354612ce4e73479a4d30cb52127","stderr_digest":"e3b0c44298fc1c149afbf4c8996fb92427ae41e4649b934ca495991b7852b855","stdout_bytes":129,"stderr_bytes":0,"stream_ref":"20261012T104809Z_2773054","stream_truncated":false,"stream_redacted":false,"item_id":"VSC-384","check_id":"chk-vsc-384-toolchain-roles","state_fingerprint_before":"f2cbcd65b8ce03ea1ca8992f458360eb597b4b7f1a331424be94038ed96394d5","state_fingerprint_after":"f2cbcd65b8ce03ea1ca8992f458360eb597b4b7f1a331424be94038ed96394d5","population_kind":"process","outcome":0,"verdict_role":"verifier","independence_tier":"instance","evidence_class":"runtime"}
