{"chain_seq":171,"ts":"2026-10-08T18:30:15Z","cwd":"<repo>","argv":["bash","-c","t=$(mktemp -d) && mkdir \"$t/scripts\" \"$t/_tools\" && cp scripts/verify-workable-items.sh \"$t/scripts/\" && cp _tools/deploy-langs.sh \"$t/_tools/\" && bash scripts/zero-gap-class-build-if-missing.sh --root \"$PWD\" --corpus \"$t\" > \"$t/out\" 2>&1; rc=$?; grep -c '^FINDING' \"$t/out\" | sed 's/^/findings=/'; rm -rf \"$t\"; exit $rc"],"exit_status":0,"duration_ms":438,"stdout_digest":"ee1f66fdefa5a4e5790838626fb31b8b04ba700864702941f4d3f36525d369e0","stderr_digest":"e3b0c44298fc1c149afbf4c8996fb92427ae41e4649b934ca495991b7852b855","stdout_bytes":11,"stderr_bytes":0,"stream_ref":"20261008T183014Z_3907489","stream_truncated":false,"stream_redacted":false,"item_id":"VSC-382","check_id":"VSC-382-build-freshness","state_fingerprint_before":"8421bf97cef18682d1698774a3710a7311232cc1e52f1d0534af114bff9e3732","state_fingerprint_after":"8421bf97cef18682d1698774a3710a7311232cc1e52f1d0534af114bff9e3732","population_kind":"source","outcome":0,"verdict_role":"verifier","independence_tier":"instance","evidence_class":"source"}
