{"chain_seq":179,"ts":"2026-10-08T18:46:14Z","cwd":"<repo>","argv":["bash","-c","bash /home/milosvasic/Projects/vasic/docs/zero-gap/checks/VSC-375.probe.sh"],"exit_status":0,"duration_ms":7280,"stdout_digest":"d55d475bfc2928e7a833962873d92dcdf934e4455a3fb87b1137eea33309b68c","stderr_digest":"e3b0c44298fc1c149afbf4c8996fb92427ae41e4649b934ca495991b7852b855","stdout_bytes":596,"stderr_bytes":0,"stream_ref":"20261008T184607Z_651864","stream_truncated":false,"stream_redacted":false,"item_id":"VSC-375","check_id":"VSC375-audits-enumerate-untracked","state_fingerprint_before":"4eed2c61a92b18465980d43f2b42dd8bca072a62eec7f893573d110042b10cbd","state_fingerprint_after":"4eed2c61a92b18465980d43f2b42dd8bca072a62eec7f893573d110042b10cbd","population_kind":"process","outcome":0,"verdict_role":"author","independence_tier":"instance","evidence_class":"runtime"}
