{"chain_seq":225,"ts":"2026-10-12T10:26:16Z","cwd":"<repo>","argv":["bash","-c","R=$(cd \"$(git rev-parse --git-common-dir)/..\" && pwd) && bash \"$R/docs/zero-gap/checks/probes/vsc-376.sh\""],"exit_status":0,"duration_ms":913,"stdout_digest":"34bcd286124ef3739bf36b21eff03fb05f62a6231e409683c54f51452916efc4","stderr_digest":"e3b0c44298fc1c149afbf4c8996fb92427ae41e4649b934ca495991b7852b855","stdout_bytes":54,"stderr_bytes":0,"stream_ref":"20261012T102614Z_2225360","stream_truncated":false,"stream_redacted":false,"item_id":"VSC-376","check_id":"VSC376-sweep-empty-population-undetermined","state_fingerprint_before":"db465fd20df8061e72596962a0bbad05752fa4fa673b1ff1c697adb62927791c","state_fingerprint_after":"db465fd20df8061e72596962a0bbad05752fa4fa673b1ff1c697adb62927791c","population_kind":"process","outcome":0,"verdict_role":"verifier","independence_tier":"instance","evidence_class":"runtime"}
