{"chain_seq":263,"ts":"2026-10-12T10:42:46Z","cwd":"<repo>","argv":["bash","-c","bash /home/milosvasic/Projects/vasic/docs/zero-gap/checks/VSC-364.probe.sh"],"exit_status":0,"duration_ms":468,"stdout_digest":"beaffc1f5f8ea919aa13e15b87ee2dba0a2baf476eff7bef42a4d9bc95ab4c63","stderr_digest":"e3b0c44298fc1c149afbf4c8996fb92427ae41e4649b934ca495991b7852b855","stdout_bytes":119,"stderr_bytes":0,"stream_ref":"20261012T104245Z_2674707","stream_truncated":false,"stream_redacted":false,"item_id":"VSC-364","check_id":"chk-vsc-364-argv-policy","state_fingerprint_before":"19ace5bda524bd2fff9fa5cf6d119176407b22af3558a9f933c7c148767432fd","state_fingerprint_after":"19ace5bda524bd2fff9fa5cf6d119176407b22af3558a9f933c7c148767432fd","population_kind":"process","outcome":0,"verdict_role":"verifier","independence_tier":"instance","evidence_class":"runtime"}
