{"chain_seq":373,"ts":"2026-10-12T14:08:55Z","cwd":"/tmp/zgv.2JT34b/cur","argv":["bash","-c","bash /home/milosvasic/Projects/vasic/docs/zero-gap/checks/VSC-353.probe.sh"],"exit_status":0,"duration_ms":8404,"stdout_digest":"63e5f7368f96d407f18d1a140a8b6cdb3334d3603f8b771fc96dea7ba379e1ec","stderr_digest":"e3b0c44298fc1c149afbf4c8996fb92427ae41e4649b934ca495991b7852b855","stdout_bytes":1043,"stderr_bytes":0,"stream_ref":"20261012T140846Z_3212954","stream_truncated":false,"stream_redacted":false,"item_id":"VSC-353","check_id":"chk-vsc-353-declared-owned-shapes","state_fingerprint_before":"a2a02a4d5ee360bf7320ab0fa93b25c0adced7129c2f72d1a8f7778d79e517d9","state_fingerprint_after":"a2a02a4d5ee360bf7320ab0fa93b25c0adced7129c2f72d1a8f7778d79e517d9","population_kind":"process","outcome":0,"verdict_role":"author","independence_tier":"instance","evidence_class":"runtime"}
